東京都練馬区向山1丁目14番5号,,35.7371981,139.6395149
東京都西東京市北町5−14−32,,35.7560156,139.566269
東京都北区東十条4−5−18ｱｰﾊﾞﾝﾌﾗｯﾄ青雲1F,,35.7664244,139.7280034
東京都西東京市南町3−6−9河合ﾋﾞﾙ1F,,35.7270202,139.5439281
東京都練馬区春日町,,35.753339,139.6426587
東京都町田市根岸,,35.5743191,139.4122942
東京都墨田区緑,,35.6944971,139.8073929
東京都足立区,,35.775017,139.8044129
東京都中野区野方4-41-9,,35.7216512,139.6561996
東京都国分寺市西町,,35.7095086,139.4351628
東京都足立区,,35.775017,139.8044129
東京都足立区,,35.775017,139.8044129
東京都足立区,,35.775017,139.8044129
東京都杉並区方南,,35.6773711,139.6617903
東京都練馬区貫井,,35.7400632,139.6324577
東京都武蔵野市境5−18−10,,35.703619,139.5333493
東京都武蔵野市桜堤1−2ｻﾝｳﾞｧﾘｴ桜堤15号棟103号室,,35.7086287,139.5338217
東京都東大和市中央2-1101-12 成安中央ﾏﾝｼｮﾝ107号室,,35.7434492,139.4309934
東京都中野区中央1-31-6,,35.6984287,139.68455
東京都足立区,,35.775017,139.8044129
東京都練馬区大泉町,,35.7643751,139.6018654
東京都練馬区石神井町,,35.7414723,139.6018654
東京都立川市若葉町,,35.7207218,139.4402459
東京都西東京市保谷町3−12−5−102,,35.729448,139.5527239
東京都葛飾区東立石,,35.7338381,139.848328
東京都足立区,,35.775017,139.8044129
東京都立川市西砂町,,35.7315518,139.3627765
東京都練馬区西大泉,,35.7586665,139.5763839
東京都足立区,,35.775017,139.8044129
東京都練馬区大泉学園町,,35.7673616,139.5865752
東京都足立区,,35.775017,139.8044129
東京都練馬区三原台,,35.7545838,139.6031397
東京都足立区,,35.775017,139.8044129
東京都墨田区京島1−6−6−105,,35.716773,139.8183584
東京都墨田区京島1−6−6−106,,35.716773,139.8183584
東京都墨田区墨田,,35.7334189,139.8214611
東京都足立区,,35.775017,139.8044129
東京都足立区,,35.775017,139.8044129
東京都足立区,,35.775017,139.8044129
東京都小平市鈴木町,,35.723202,139.5000058
東京都練馬区西大泉,,35.7586665,139.5763839
東京都足立区,,35.775017,139.8044129
東京都足立区,,35.775017,139.8044129
東京都町田市能ヶ谷,,35.5870987,139.4834704
東京都足立区,,35.775017,139.8044129
東京都葛飾区鎌倉,,35.7461183,139.8790478
東京都台東区浅草,,35.7185858,139.7958849
東京都台東区千束,,35.7238117,139.7946064
東京都葛飾区立石,,35.740726,139.848328
東京都足立区,,35.775017,139.8044129
東京都足立区,,35.775017,139.8044129
東京都府中市八幡町,,35.6680838,139.4911015
東京都府中市若松町四丁目10番地の11,,35.6755164,139.4998965
東京都三鷹市大沢,,35.6780778,139.5356365
東京都品川区小山2−16−10,,35.6196914,139.7094845
東京都品川区中延2−5−10 ASCﾋﾞﾙ1階,,35.6112911,139.7112244
東京都品川区西五反田3−13−14 ﾛｲﾔﾙｺｰﾄ目黒 101,,35.6280898,139.7141748
東京都小金井市東町4丁目31−17,,35.6996764,139.5247831
東京都西東京市柳沢1−15−3 107号,,35.7278339,139.5531959
東京都台東区雷門2−1−10,,35.709954,139.7977194
東京都豊島区南大塚3丁目32番1号大塚S&Sﾋﾞﾙ101号室,,35.7312235,139.7268442
東京都豊島区南長崎3丁目16番17号青木ﾋﾞﾙ1階,,35.724413,139.6887245
東京都杉並区阿佐谷北5−47−11 ﾙｾｰﾇ阿佐ヶ谷1階,,35.7115361,139.6428344
東京都杉並区大宮2−1−4 1階,,35.681952,139.6426786
東京都品川区東大井6−11−9武内ﾊｲﾂ101号室,,35.6021741,139.7364456
東京都品川区東五反田2−16−2 ｵｰﾊﾞﾙｺｰﾄ大崎ﾋﾞｭｰﾌﾟﾗｻﾞ102,,35.6227023,139.7298243
東京都江東区東雲1−9 東雲ｷｬﾅﾙｺｰﾄCODAN16号棟210号室,,35.6470689,139.8030372
東京都豊島区巣鴨5丁目23番8号 ｿｼｴ巣鴨1階,,35.7414536,139.7317996
東京都江東区豊洲4−10豊洲四丁目団地4号棟106号室,東京都江東区豊洲4−10,35.6538208,139.8025976
東京都中野区大和町1−12−8 ﾌﾟﾚｽﾃｰｼﾞ高円寺1階,,35.7129832,139.6535126
東京都中野区弥生町2−32−10 ｱｲｻﾞﾜﾋﾞﾙ1階,,35.690888,139.6735002
東京都江東区深川二丁目16番10号1階,,35.6765021,139.7968515
東京都東村山市秋津町5−12−65,,35.7766846,139.4936455
東京都足立区舎人一丁目25番9号,,35.8056309,139.7679649
東京都足立区舎人一丁目25番9号,,35.8056309,139.7679649
東京都練馬区栄町46番1号,,35.7399583,139.6692874
東京都国立市富士見台4−10−6 2F,,35.6859444,139.4316487
東京都東村山市栄町1−10−1,,35.7485973,139.4743095
東京都東村山市諏訪町1−2−7ﾏｸﾞﾉﾘｱ1階,,35.7646228,139.4667658
東京都葛飾区新小岩1−42−10,,35.7157215,139.8590653
東京都葛飾区東新小岩1−2−11,,35.7185262,139.8585255
東京都小金井市貫井南町4丁目14番14号ｳﾞｨﾚｯｼﾞﾊﾟﾙ1F,,35.6959853,139.4945796
東京都武蔵野市桜堤1−2−19−101,,35.7083438,139.5344822
東京都武蔵野市桜堤1−2−14−103,,35.7077372,139.5354134
東京都武蔵野市緑町2−3−B8−104,,35.7176957,139.5643397
東京都板橋区徳丸2−30−16,,35.7756346,139.662372
東京都西東京市泉町3−12−25ﾊﾟｽﾚﾙ保谷1階,,35.7420847,139.5579196
東京都葛飾区東金町,,35.7743066,139.8777675
東京都東村山市久米川町,,35.767809,139.4745686
東京都足立区,,35.775017,139.8044129
東京都足立区,,35.775017,139.8044129
東京都足立区,,35.775017,139.8044129
東京都日野市南平7丁目22番地の29,,35.6553887,139.3929464
東京都国立市谷保,,35.6776469,139.4440586
東京都足立区,,35.775017,139.8044129
東京都足立区,,35.775017,139.8044129
東京都足立区,,35.775017,139.8044129
東京都足立区,,35.775017,139.8044129
東京都足立区,,35.775017,139.8044129
東京都葛飾区東四つ木,,35.7284712,139.8406505
東京都町田市成瀬,,35.5427467,139.4758402
東京都足立区,,35.775017,139.8044129
東京都墨田区押上,,35.7113453,139.8150661
東京都狛江市岩戸北,,35.6363632,139.5827532
東京都足立区,,35.775017,139.8044129
東京都杉並区阿佐谷北1−3−10Baum1階,,35.705237,139.6382752
東京都品川区南品川2−15−14,,35.6133767,139.7445051
東京都西東京市田無町4−11−2,,35.7266951,139.5325117
東京都練馬区関町南3−11−16−501,,35.7213843,139.5807942
東京都杉並区高井戸東4−10−30 ｻﾝﾊｲﾑ高井戸101,,35.689662,139.6184717
東京都豊島区池袋本町1丁目45番19号,,35.7405787,139.7137779
東京都豊島区目白5丁目25番6号 ｺｲﾜｲﾋﾞﾙ1階,,35.7254389,139.6966217
東京都あきる野市野辺462−17,,35.7263572,139.3107901
東京都あきる野市秋川2−7−4 丸昌ﾋﾞﾙ1階,,35.7292593,139.2865101
東京都葛飾区青戸3−10−5,,35.746304,139.848829
東京都新宿区上落合一丁目17番8号,,35.7160662,139.6941115
東京都東大和市向原1−4−1,,35.74151,139.4421522
東京都目黒区中央町2−32−23,,35.6315685,139.6880823
東京都品川区荏原4−8−11 佐藤ﾋﾞﾙ1階,,35.6155152,139.7062754
東京都町田市成瀬が丘2−23−14,,35.5351354,139.4721248
東京都町田市大蔵町5002−2鶴川ﾒﾃﾞｨｶﾙﾓｰﾙ2B2,,35.5822895,139.4778669
東京都町田市大蔵町5002−2鶴川ﾒﾃﾞｨｶﾙﾓｰﾙ2B1,,35.5822895,139.4778669
東京都板橋区氷川町24−2,,35.7544131,139.7051016
東京都日野市平山5丁目8番地の8,,35.6482335,139.382542
東京都杉並区高井戸西1−12−1,,35.6818843,139.6086756
東京都東大和市桜が丘3−44−32ｺｰｼｬﾊｲﾑ玉川上水3号棟103,,35.7329473,139.4188348
東京都墨田区東駒形四丁目4番8号ｴｽﾃﾗｰﾄ寺内1階,,35.7054971,139.8051024
東京都墨田区八広六丁目37番5号ｿﾙｿﾚｲﾕ1階,,35.7259051,139.8289359
東京都杉並区上荻2−7−9,,35.7045693,139.6120121
東京都杉並区上荻1−18−3亀屋酒販第2ﾋﾞﾙ,,35.7058115,139.6179889
東京都板橋区若木3−15−1,,35.7725151,139.6747923
東京都練馬区下石神井4−27−18,,35.7259106,139.6016959
東京都練馬区春日町2丁目14番45号ｸﾞﾘｰﾝﾋﾙ平和台1階,,35.7569698,139.6489156
東京都練馬区春日町2丁目14番45号ｸﾞﾘｰﾝﾋﾙ平和台1階,,35.7569698,139.6489156
東京都板橋区大谷口上町7−10,,35.7508499,139.6937917
東京都豊島区西池袋5丁目26番16号,,35.7326801,139.6999163
東京都練馬区豊玉南3丁目31番15号,,35.7304331,139.6503704
東京都板橋区大門8−5,,35.7838134,139.6499319
東京都練馬区石神井町3丁目30番18号,,35.7432468,139.601696
東京都東村山市青葉町3−9−33,,35.7678575,139.4951371
東京都足立区竹の塚一丁目12番11号,,35.7907616,139.7933657
東京都足立区綾瀬四丁目6番5号,,35.7617987,139.8216652
東京都足立区関原三丁目43番4号 細川ﾋﾞﾙ1階,,35.7712572,139.7851182
東京都足立区中央本町五丁目2番3号,,35.7777543,139.8033969
東京都足立区竹の塚六丁目9番11号,,35.7945981,139.7933678
東京都足立区綾瀬四丁目31番15号,,35.7680947,139.8242792
東京都練馬区上石神井1丁目11番13号1F,,35.7246286,139.5910785
東京都東大和市立野2−4−13,,35.7458614,139.4174302
東京都東大和市立野3−1293−10,,35.7386618,139.4244063
東京都北区浮間3−1−55−2F,,35.7870146,139.7046296
東京都西東京市新町1−11−25,,35.7176633,139.543916
東京都町田市鶴間1−16−1,,35.5122849,139.4689086
東京都町田市鶴間1−16−1,,35.5122849,139.4689086
東京都青梅市末広町2−7−34,,35.7779737,139.308338
東京都足立区,,35.775017,139.8044129
東京都足立区,,35.775017,139.8044129
東京都練馬区中村,,35.7320841,139.6439339
東京都足立区,,35.775017,139.8044129
東京都立川市栄町,,35.7080746,139.4288095
東京都町田市能ヶ谷,,35.5870987,139.4834704
東京都練馬区向山,,35.7425144,139.6413835
東京都稲城市矢野口620,,35.6404391,139.5194724
東京都稲城市矢野口620,,35.6404391,139.5194724
東京都稲城市若葉台,,35.6254909,139.470754
東京都稲城市向陽台,,35.6412287,139.4898296
東京都稲城市矢野口,,35.6331886,139.5152735
東京都三鷹市中原,,35.6679027,139.5700153
東京都足立区,,35.775017,139.8044129
東京都練馬区桜台,,35.7432266,139.6630659
東京都練馬区石神井町,,35.7414723,139.6018654
東京都豊島区池袋2丁目35番5号,,35.7333576,139.7065533
東京都練馬区谷原,,35.7528543,139.6158849
東京都足立区,,35.775017,139.8044129
東京都墨田区向島4−28−4,,35.7143457,139.8129279
東京都足立区,,35.775017,139.8044129
東京都練馬区石神井台,,35.7353016,139.5865752
東京都杉並区今川,,35.7166685,139.6056885
東京都練馬区南大泉,,35.7428701,139.5712889
東京都三鷹市上連雀,,35.695471,139.5560067
東京都練馬区栄町,,35.7386022,139.6700826
東京都足立区,,35.775017,139.8044129
東京都杉並区和泉,,35.6749251,139.6528614
東京都調布市八雲台1−22−1八雲台ｸﾘｰﾝﾊｲﾑ103,,35.6543529,139.553082
東京都足立区,,35.775017,139.8044129
東京都足立区,,35.775017,139.8044129
東京都国分寺市戸倉三丁目22番地21,,35.7066349,139.4531671
東京都練馬区大泉学園町,,35.7673616,139.5865752
東京都足立区,,35.775017,139.8044129
東京都立川市上砂町,,35.7275331,139.3894347
東京都中野区弥生町2−3−1,,35.6907329,139.6765218
東京都板橋区蓮沼町73−14,,35.7733862,139.7047508
東京都西東京市北原町,,35.7354986,139.5445476
東京都西東京市芝久保町,,35.7289222,139.5254541
東京都練馬区平和台,,35.7576087,139.6617903
東京都板橋区坂下2−31−13,,35.784642,139.6823836
東京都足立区,,35.775017,139.8044129
東京都足立区,,35.775017,139.8044129
東京都足立区,,35.775017,139.8044129
東京都西東京市田無町3−7−5−101,,35.7293758,139.5437151
東京都文京区音羽1−1−7 正進社ﾎｰﾙﾃﾞｨﾝｸﾞｽ1F,,35.7111984,139.7319874
東京都練馬区練馬3丁目22番3号,,35.7393727,139.6494605
東京都国立市富士見台,,35.6851422,139.4427877
東京都練馬区富士見台,,35.7376115,139.6235333
東京都足立区,,35.775017,139.8044129
東京都足立区,,35.775017,139.8044129
東京都文京区白山5−17−25,,35.7262453,139.7472527
東京都足立区,,35.775017,139.8044129
東京都武蔵野市八幡町,,35.7177454,139.5572801
東京都足立区,,35.775017,139.8044129
東京都墨田区八広,,35.7216926,139.8265777
東京都足立区,,35.775017,139.8044129
東京都墨田区押上,,35.7113453,139.8150661
東京都足立区,,35.775017,139.8044129
東京都練馬区早宮,,35.7528669,139.6528614
東京都町田市三輪緑山,,35.5724774,139.4898296
東京都足立区,,35.775017,139.8044129
東京都足立区,,35.775017,139.8044129
東京都足立区,,35.775017,139.8044129
東京都豊島区長崎5丁目9番15号 ﾍﾞﾙﾒｿﾞﾝ長崎105号室,,35.7318851,139.6833603
東京都墨田区立花,,35.7099633,139.8316947
東京都足立区,,35.775017,139.8044129
東京都練馬区貫井,,35.7400632,139.6324577
東京都葛飾区金町,,35.7656212,139.867526
東京都目黒区東山2−26−20,,35.6448059,139.6859144
東京都新宿区市谷本村町5番1号,,35.692686,139.7287793
東京都練馬区中村,,35.7320841,139.6439339
東京都台東区浅草橋4丁目14番4号 ﾘﾌﾞﾗﾝ今井1階,,35.6984223,139.7809639
東京都武蔵野市関前,,35.7117377,139.5509135
東京都足立区,,35.775017,139.8044129
東京都足立区,,35.775017,139.8044129
東京都練馬区土支田,,35.7632781,139.6133356
東京都足立区,,35.775017,139.8044129
東京都足立区,,35.775017,139.8044129
東京都中野区中央3-36-6,,35.6985429,139.6716176
東京都足立区,,35.775017,139.8044129
東京都豊島区高田,,35.7149758,139.7153917
東京都練馬区東大泉,,35.749043,139.5865752
東京都立川市幸町,,35.7243118,139.4237274
東京都葛飾区堀切,,35.7446487,139.8265777
東京都足立区,,35.775017,139.8044129
東京都足立区,,35.775017,139.8044129
東京都足立区,,35.775017,139.8044129
東京都足立区,,35.775017,139.8044129
東京都立川市曙町,,35.7002274,139.4122942
東京都足立区,,35.775017,139.8044129
東京都足立区,,35.775017,139.8044129
東京都足立区,,35.775017,139.8044129
東京都練馬区大泉学園町,,35.7673616,139.5865752
東京都練馬区桜台2丁目36番9号1階,,35.7435017,139.6633319
東京都練馬区豊玉上2丁目17番1号ｰ101,,35.7365837,139.6626549
東京都目黒区上目黒5−26−6 ｸﾞﾛﾘｱ上目黒101,,35.6419746,139.6875679
東京都大田区上池台1−7−7 ｽﾍﾟｯｸﾚｼﾞﾃﾞﾝｽ長原1階,,35.6017733,139.6988918
東京都大田区雪谷大塚町13-19 ﾊﾟｰｸｻｲﾄﾞｽﾍﾟｯｸ田園調布1階,,35.5894,139.6778936
東京都品川区平塚2−5−12,,35.6183093,139.7153228
東京都中野区大和町3−41−9,,35.7121871,139.644193
東京都中野区新井4−32−22,,35.7181775,139.6640436
東京都中野区若宮3−3−11 家政ﾊｲﾂ1階,,35.7196922,139.6458606
東京都杉並区上荻3−22−13,,35.7096217,139.6097849
東京都台東区三筋2−17−10ﾊﾞﾑﾀｲｶﾞｰ201,,35.7058758,139.7865935
東京都千代田区東神田,,35.6955411,139.7799054
東京都千代田区飯田橋,,35.7004584,139.7492367
東京都千代田区三番町7番地,,35.6903762,139.7441268
東京都東村山市野口町3−13−15,,35.7634697,139.4549915
東京都武蔵野市境南町5−6−23 ｸﾚｽﾄ武蔵野101,,35.6977235,139.5381382
東京都葛飾区亀有5−19−7,,35.7676972,139.8463086
東京都葛飾区東金町2−18−1ﾏﾙﾏｽﾋﾞﾙ201,,35.7719036,139.8683102
東京都練馬区北町2−13−11,,35.7660961,139.6613958
東京都武蔵野市関前4−17−10 ﾕﾘｲｶﾏﾝｼｮﾝ1階,,35.7162475,139.5496226
東京都文京区大塚4丁目50番1号大塚みどりの郷1階,,35.7246721,139.7307914
東京都文京区大塚4丁目50番1号大塚みどりの郷1階,,35.7246721,139.7307914
東京都杉並区高円寺南2−32−5高円寺中央会議室1階,,35.6994521,139.6525619
東京都杉並区西荻南2−8−16ﾒｿﾞﾝ･ﾄﾞ･ｴﾃﾙﾅ1階,,35.699398,139.5990617
東京都練馬区桜台3−42−6桜台ﾊﾟｰｸﾎｰﾑｽﾞｺﾝｿｰﾄ107号室,,35.7475365,139.663619
東京都練馬区豊玉北6−13−17ｸﾞﾛｰﾘｱ初穂練馬101,,35.7364259,139.651749
東京都練馬区桜台4−10−9,,35.7390893,139.6604272
東京都足立区東和2−20−21,,35.7694787,139.8421799
東京都文京区春日,,35.708612,139.7466817
東京都杉並区清水1−16−10 ﾚｼﾞﾃﾞﾝｽ荻窪102,,35.7098955,139.615229
東京都杉並区荻窪3−35−5 ﾊｳｽMM101号,,35.7008444,139.6254432
東京都小平市中島町,,35.7300073,139.4307154
東京都千代田区霞が関3−1−1財務省本庁舎,,35.6731093,139.7480227
東京都文京区春日2丁目25番3号,,35.7099633,139.7456955
東京都足立区,,35.775017,139.8044129
東京都足立区,,35.775017,139.8044129
東京都文京区湯島1丁目5番45号6号館1階,,35.701409,139.7649284
東京都武蔵野市関前1−2−20,,35.7081999,139.5534866
東京都青梅市新町2丁目33番地の4,,35.7904654,139.3023147
東京都町田市町田市木曽東3−16−17,,35.5625503,139.4239697
東京都東大和市狭山1‐849‐1,,35.759068,139.4363902
東京都東大和市上北台2‐886‐36,,35.7433815,139.4116025
東京都東大和市向原1‐4‐2,,35.7418784,139.440145
東京都東大和市清原3‐1,,35.741644,139.4488247
東京都東村山市恩多町5-17-14,,35.7607081,139.4847086
東京都東大和市向原6‐1,,35.7360166,139.4370689
東京都葛飾区西新小岩4-35-5,,35.7205156,139.8534369
東京都東大和市東大和市中央4−1023−4,,35.4875153,139.4579975
東京都東大和市中央2‐858‐1,,35.7452806,139.4291
東京都東大和市蔵敷3‐691‐2,,35.7498075,139.4192317
東京都東大和市芋窪3‐1615,,35.7528661,139.4137846
東京都東大和市南街4‐3‐1,,35.7380236,139.4332189
東京都東大和市桜が丘3‐44‐18,,35.7343219,139.4181783
東京都東大和市立野2−3−7,,35.7442877,139.4180105
東京都東大和市清原2‐2‐2,,35.7445048,139.4443366
東京都東大和市桜が丘4‐29‐18,,35.7352205,139.4164028
東京都東大和市立野3−580−2,,35.7392567,139.4226053
東京都東大和市狭山3‐1349‐4,,35.7552902,139.4370397
東京都東大和市清水3‐859‐7,,35.7527305,139.4435799
東京都練馬区氷川台四丁目53番17号,,35.7513589,139.6641423
東京都練馬区平和台四丁目11番3号,,35.7573908,139.6564487
東京都稲城市矢野口1075−1､他,,35.6331886,139.5152735
東京都稲城市百村1623号1ﾊﾟｽﾄﾗﾙﾊｲﾑ1階,,35.6355946,139.5014768
東京都稲城市百村1607番3稲城駅前KMﾋﾞﾙ2階,,35.6364309,139.4995042
東京都稲城市矢野口4015番地の1よみうりﾗﾝﾄﾞ本社ﾋﾞﾙ1階,,35.6319944,139.5171027
東京都稲城市若葉台4‐17,,35.6282129,139.4675753
東京都稲城市平尾3‐1‐23,,35.6101184,139.4874597
東京都稲城市矢野口256,,35.6426943,139.5192461
東京都稲城市東長沼2115−2,,35.6377993,139.5013986
東京都稲城市矢野口2065,,35.6344237,139.5207215
東京都稲城市大丸82‐4,,35.6453107,139.4995949
東京都稲城市向陽台5‐8,,35.6388548,139.4853781
東京都稲城市向陽台6‐4,,35.6425733,139.4917375
東京都稲城市百村1461−1,,35.6321301,139.5044187
東京都稲城市若葉台1‐54,,35.6265203,139.473297
東京都稲城市長峰2‐10,,35.6306375,139.4834704
東京都稲城市坂浜1012‐2,,35.6224942,139.4851757
東京都練馬区田柄二丁目50番2号,,35.7696511,139.6434756
東京都練馬区平和台二丁目48番3号,,35.7598378,139.6585386
東京都練馬区南大泉四丁目30番12号,,35.7448178,139.5721248
東京都西東京市保谷町三丁目17番21号,,35.7311083,139.5517098
東京都西東京市新町三丁目11番6号,,35.7157363,139.5370203
東京都西東京市保谷町三丁目24番25号,,35.7294047,139.5515103
東京都西東京市ひばりが丘三丁目4番2号 ｼﾃｨﾃﾗｽひばりが丘 共用棟1･2F,,35.7441489,139.5340056
東京都西東京市住吉町四丁目6番12号,,35.7473162,139.5502238
東京都西東京市泉町三丁目13番24号,,35.7400286,139.5554894
東京都西東京市西東京市新町五丁目14番14号,,35.7151712,139.5344432
東京都西東京市泉町二丁目6番10号,,35.7394877,139.5499101
東京都西東京市新町一丁目11番25号,,35.7176633,139.543916
東京都西東京市下保谷二丁目4番2号,,35.7522353,139.5588302
東京都西東京市下保谷三丁目8番15号,,35.7548312,139.5665791
東京都西東京市住吉町三丁目14番14号,,35.7496946,139.5493539
東京都西東京市ひばりが丘三丁目1番25号,,35.7462496,139.536989
東京都西東京市中町四丁目4番16号,,35.737204,139.564304
東京都西東京市富士町一丁目7番2号,,35.7339147,139.5603531
東京都西東京市東伏見二丁目11番11号,,35.727545,139.5601797
東京都西東京市東町二丁目4番13号,,35.7460648,139.5605332
東京都西東京市ひばりが丘二丁目3番5号,,35.7471575,139.5403595
東京都西東京市保谷町三丁目13番1号,,35.7296125,139.5531327
東京都西東京市柳沢五丁目8番2号,,35.7220912,139.5511051
東京都狛江市中和泉3−19−14,,35.635437,139.5671888
東京都狛江市狛江市岩戸北3−23−8,,35.632316,139.5829078
東京都狛江市狛江市岩戸北3−3−23,,35.634554,139.5824646
東京都練馬区大泉学園町ﾆ丁目30番44号,,35.7673616,139.5865752
東京都練馬区南大泉五丁目36番12号,,35.7496452,139.5684431
東京都狛江市元和泉一丁目10番10号,,35.6320749,139.5758067
東京都狛江市東野川一丁目32番2号,,35.6420385,139.5833006
東京都狛江市和泉本町四丁目7番35号,,35.6421326,139.5698093
東京都狛江市岩戸北三丁目20番2号,,35.6363632,139.5827532
東京都狛江市駒井町二丁目28番6号,,35.6244183,139.5875713
東京都狛江市西和泉一丁目5番1号,,35.6404237,139.5634769
東京都狛江市和泉本町一丁目36番4号,,35.6362624,139.5779744
東京都狛江市西野川四丁目12番1号,,35.6470759,139.5727636
東京都狛江市中和泉三丁目12番6号,,35.6368895,139.5705128
東京都狛江市東和泉一丁目32番18号,,35.6304076,139.5763948
東京都狛江市狛江市東和泉1−35−10,,35.6296041,139.5755878
東京都狛江市狛江市岩戸北1−1−12,,35.635744,139.5798339
東京都練馬区石神井町八丁目22番14号,,35.7465281,139.5996094
東京都練馬区関町北二丁目23番14号,,35.7266153,139.5752096
東京都狛江市狛江市西野川2−4−15,,35.6440155,139.5749907
東京都狛江市東和泉一丁目34番25号,,35.6295971,139.5769918
東京都奥多摩町西多摩郡奥多摩町氷川1416番,,35.8061583,139.0953531
東京都奥多摩町西多摩郡奥多摩町小丹波528番地,,35.8175808,139.1531765
東京都練馬区関町南四丁目19番6号,,35.7209211,139.5693944
東京都練馬区石神井町七丁目9番5号,,35.7427439,139.5992973
東京都青梅市大門2‐253,,35.7953563,139.292294
東京都青梅市谷野191番地1,,35.8049407,139.2891021
東京都青梅市野上町3‐12‐1,,35.7917161,139.2906785
東京都青梅市柚木町2‐312‐1,,35.7999877,139.2121032
東京都青梅市長淵7‐311,,35.7814824,139.2632651
東京都青梅市二俣尾4‐1067,,35.8053059,139.2161441
東京都青梅市今寺1−531−2,,35.8000966,139.2960608
東京都青梅市沢井2‐843,,35.8063897,139.1940454
東京都青梅市今井2‐1125‐2,,35.8042097,139.3099329
東京都青梅市千ヶ瀬町3‐389−9,,35.7852869,139.2685517
東京都青梅市友田町4‐106,,35.7722014,139.2889893
東京都青梅市小曾木4‐2227‐1,,35.8224477,139.278005
東京都青梅市成木四丁目683番5号,,35.8228429,139.2499321
東京都青梅市新町2‐21‐9,,35.7883741,139.3027242
東京都青梅市新町8‐5‐2,,35.7828438,139.3116747
東京都青梅市河辺町7‐14‐2,,35.7817465,139.2952924
東京都青梅市日向和田2‐374‐7,,35.7854226,139.2355727
東京都青梅市梅郷3‐776‐7,,35.787789,139.2237267
東京都青梅市河辺町6‐12‐3,,35.779313,139.2910944
東京都青梅市河辺町4‐20‐12,,35.781012,139.2865353
東京都青梅市畑中2‐593,,35.7833363,139.2412473
東京都青梅市大門3‐4‐5,,35.7924184,139.2971957
東京都青梅市長淵4‐225,,35.7784959,139.2746706
東京都青梅市東青梅6‐1‐12,,35.7934939,139.2729449
東京都青梅市師岡町4‐8‐8,,35.7884595,139.2831393
東京都青梅市師岡町1‐113‐20,,35.7949189,139.2810245
東京都青梅市師岡町3‐10‐5,,35.7913583,139.2824201
東京都青梅市東青梅5‐22‐2,,35.7907468,139.279522
東京都青梅市滝ﾉ上町1274‐1,,35.7891923,139.2556049
東京都青梅市駒木町2‐46‐1,,35.780554,139.2523474
東京都あきる野市二宮東一丁目12番地9,,35.724056,139.322633
東京都あきる野市瀬戸岡446番地,,35.7381141,139.2884429
東京都あきる野市雨間1067番地6,,35.7202805,139.2981348
