千葉県松戸市三ｹ月1534,,35.8164106,139.9219739
千葉県松戸市小金原4‐6,,35.821183,139.9405347
千葉県松戸市高塚新田494‐9,,35.7581022,139.9352326
千葉県松戸市六高台1‐40,,35.7957138,139.9832916
千葉県松戸市牧の原2‐73,,35.7901623,139.951049
千葉県松戸市西馬橋広手町123,,35.813634,139.9067154
千葉県松戸市古ｹ崎4‐3617,,35.8063955,139.899613
千葉県松戸市日暮4‐5‐2,,35.7879178,139.938828
千葉県松戸市中金杉3‐192,,35.8383889,139.9227196
千葉県松戸市二十世紀ｹ丘戸山町73,,35.7725886,139.9135288
千葉県松戸市松戸新田554‐2,,35.7837079,139.9191312
千葉県松戸市新松戸北2‐11‐3,,35.8314381,139.9109327
千葉県松戸市新松戸3‐111,,35.8256478,139.9123423
千葉県松戸市五香西4‐44‐1,,35.7858305,139.9615812
千葉県松戸市新松戸南2‐17,,35.8206506,139.9112446
千葉県松戸市新松戸7‐145‐3,,35.8290663,139.9001364
千葉県松戸市古ｹ崎1‐2994‐2,,35.7982083,139.8955713
千葉県松戸市上矢切113,,35.7655741,139.8985158
千葉県松戸市稔台2‐12‐1,,35.7856323,139.9342175
千葉県松戸市六実6‐13,,35.7962705,139.9975946
千葉県松戸市栄町3‐185-1,,35.8047051,139.9058205
千葉県松戸市日暮1‐8‐4,,35.7916775,139.9418061
千葉県松戸市松戸2283-2,,35.7786301,139.9060093
千葉県松戸市野菊野5,,35.7791325,139.9134774
千葉県松戸市金ヶ作306,,35.8037932,139.9634784
千葉県松戸市松戸新田605‐58,,35.7940871,139.9304263
千葉県松戸市新松戸6‐118‐1,,35.8264275,139.9062007
千葉県松戸市小金原4‐37‐15,,35.8200237,139.941968
千葉県松戸市上矢切1101‐2,,35.7717521,139.8899115
千葉県松戸市上本郷2292,,35.7974218,139.9111502
千葉県松戸市西馬橋3‐49‐2,,35.8168719,139.9120599
千葉県松戸市金ｹ作216‐10,,35.8066246,139.9486696
千葉県松戸市小金原8‐19‐20,,35.8158189,139.9431846
千葉県松戸市中和倉331,,35.8043266,139.9239498
千葉県松戸市小山523‐5,,35.7728363,139.8941128
千葉県松戸市西馬橋1‐28‐16,,35.8172421,139.9174097
千葉県松戸市松戸1394,,35.7816175,139.9001268
千葉県松戸市仲井町1‐32‐6,,35.790782,139.919872
千葉県松戸市六実5‐1‐1,,35.7947817,139.9995307
千葉県松戸市紙敷3‐8‐11,,35.7731553,139.9491801
千葉県松戸市高塚新田450‐11,,35.7629988,139.9347276
千葉県松戸市小金原8‐11‐1,,35.8135695,139.9407247
千葉県松戸市新松戸1‐345‐2,,35.8276878,139.9220139
千葉県松戸市紙敷字大久保1194番4外,,35.7719375,139.9379715
千葉県松戸市本町13-9,,35.7864041,139.8978113
千葉県松戸市常盤平3‐25‐2,,35.8007341,139.956998
千葉県松戸市高塚新田488‐10,,35.76145,139.9319243
千葉県松戸市栄町3-185‐1,,35.8047051,139.9058205
千葉県松戸市紙敷3‐8‐11,,35.7731553,139.9491801
千葉県松戸市根本12-16,,35.7883464,139.9000429
千葉県松戸市和名ヶ谷1104−1,,35.7787341,139.9234353
千葉県松戸市東松戸2−16−4,,35.7699811,139.9454918
千葉県松戸市五香2−35−8,,35.7957336,139.9725441
千葉県松戸市高塚新田413−11,,35.7581546,139.9379715
千葉県松戸市新松戸一丁目82番,,35.8303391,139.9239809
千葉県松戸市紙敷1−38−8,,35.7722612,139.9540324
千葉県松戸市秋山字向山45番地の2,,35.7632541,139.9277197
千葉県松戸市松戸市小根本161−3,,35.7885579,139.9094431
千葉県松戸市松戸市大金平3−132−1,,35.8374949,139.9212969
千葉県松戸市松戸市西馬橋蔵元町134−1,,35.8140435,139.913987
千葉県松戸市松戸市常盤平3−1−1UR常盤平駅前市街地ｱﾊﾟｰﾄ2階,,35.8029085,139.9512071
千葉県松戸市古ｹ崎1-3073,,35.7944747,139.8956542
千葉県松戸市紙敷1080−1,,35.7724189,139.9396736
千葉県松戸市牧の原2−5,,35.7901353,139.9526914
千葉県松戸市新松戸北1−11−15,,35.8307019,139.9177228
千葉県松戸市松戸市大橋字向山300−1,,35.7677142,139.9187509
千葉県松戸市新作1035−2,,35.8075574,139.9203724
千葉県松戸市松戸市殿平賀慶林寺台200−11,,35.8332631,139.9290612
千葉県松戸市本町12−17 秋本ﾋﾞﾙ101号,,35.7853087,139.8977154
千葉県松戸市松戸市常盤平3−13−3,,35.802813,139.9533925
千葉県松戸市松戸市松戸新田373 ｶﾞｰﾃﾞﾝﾋﾞﾚｯｼﾞ106号,,35.7920278,139.9283804
千葉県松戸市松戸市新松戸3−256,,35.8226687,139.9164246
千葉県松戸市松戸市松戸1344−1,,35.7809241,139.9011974
千葉県松戸市松戸市上本郷867−5 ｻﾎﾟｰﾚ北松戸101,,35.800109,139.9108141
千葉県松戸市松戸市馬橋179−1 馬橋ｽﾃｰｼｮﾝﾓｰﾙ1F,,35.8119154,139.9168692
千葉県松戸市松戸市日暮2−3−15 ｸﾞﾘｰﾝﾌﾟﾗｻﾞ八柱第一101号,,35.7921168,139.9373708
千葉県松戸市松戸市野菊野7−2,,35.7787563,139.913176
千葉県松戸市松戸市根本2−16 ﾌﾟﾗﾝﾃｨｰｸ2階,,35.7866552,139.9006371
千葉県松戸市松戸市松戸1227−1 ｱﾝｾｲｴ松戸2階,,35.783699,139.9016488
千葉県松戸市松戸市松戸1227−1 ｱﾝｾｲｴ松戸2階,,35.783699,139.9016488
千葉県松戸市松戸市上本郷907−4 ｱｰﾊﾞﾝﾗｲﾌ安田,,35.800936,139.912294
千葉県松戸市松戸市上本郷2672−9 新京成上本郷駅ﾋﾞﾙ2F,,35.7897487,139.9163439
千葉県松戸市松戸市小金2−15 北小金ﾋﾟｺﾃｨ西館108,,35.832383,139.9311234
千葉県松戸市松戸市松戸1333 ｺｽﾓ松戸ｽﾃｰｼｮﾝｽｸｴｱ1階,,35.7821265,139.9007176
千葉県松戸市松戸市五香南1−5−1,,35.7901833,139.9759102
千葉県松戸市松戸市常盤平2−9−3,,35.802534,139.9504882
千葉県松戸市松戸市六実5−1−26,,35.7923052,140.0004059
千葉県松戸市松戸市馬橋179−1 馬橋ｽﾃｰｼｮﾝﾓｰﾙ1F B−1,,35.8119154,139.9168692
千葉県松戸市松戸市常盤平5−11−23 ｲﾝｼｭﾗﾝｽﾋﾞﾙ�U102,,35.79793,139.9649689
千葉県松戸市松戸市千駄堀1598,,35.7990055,139.9258177
千葉県松戸市松戸市本町14−18 松戸ﾄｼｵﾋﾞﾙ1F,,35.7744493,139.9106124
千葉県松戸市松戸市新松戸3−129−1,,35.823885,139.9175932
千葉県松戸市根本12−2,,35.7884719,139.8998486
千葉県松戸市松戸市松戸1129−1 ﾆｭｰﾊﾟｳﾘｽﾀﾋﾞﾙ1階,,35.7809483,139.9014376
千葉県松戸市松戸市新松戸1−186 第2ﾛｲﾔﾙﾏﾝｼｮﾝ101,,35.8293498,139.9212195
千葉県松戸市松戸市三矢小台3−9−10 三矢小台ﾋﾞﾙ1F,,35.7665823,139.8997142
千葉県松戸市松戸市二ﾂ木757−1 ﾗｯｸﾌｨｰﾙﾄﾞ1F,,35.8208471,139.9212732
千葉県松戸市松戸市稔台7−14−3 ｴﾝｾﾞﾙ21 1F,,35.7871384,139.9300958
千葉県松戸市松戸市新松戸4−28−1 ｼﾞｭﾈｼｵﾝ新松戸1F,,35.8274269,139.9194786
千葉県松戸市松戸市東松戸1−2−3,,35.7711454,139.9444184
千葉県松戸市松戸市下矢切75−1 矢切ﾋﾞﾙ1階,,35.7599536,139.8993563
千葉県野田市柳沢83,,35.9612631,139.8704398
千葉県野田市清水881,,35.9562974,139.8534869
千葉県野田市上花輪新町14,,35.9379593,139.8633659
千葉県野田市中根30‐1,,35.9452741,139.8772474
千葉県野田市鶴奉228,,35.9604663,139.8859099
千葉県野田市中野台17,,35.9490695,139.8543211
千葉県野田市山崎1214,,35.9294146,139.8818085
千葉県野田市尾崎1714,,35.9915584,139.8297358
千葉県野田市谷津682‐2,,35.974215,139.8547205
千葉県野田市木野崎1648‐6,,35.9492973,139.9089427
千葉県野田市木間ｹ瀬3152‐1,,36.0188383,139.8414787
千葉県野田市上三ｹ尾454‐1,,35.9240386,139.9272793
千葉県野田市中野台564‐2,,35.9401681,139.8532469
千葉県野田市なみき2-3-3,,36.0365058,139.8209415
千葉県野田市谷津367,,35.9691965,139.8515672
千葉県野田市尾崎853‐12階,,35.9794467,139.8358726
千葉県野田市桜の里1‐1‐5,,35.9553679,139.8488479
千葉県野田市山崎1952,,35.9310195,139.8923926
千葉県野田市古布内1527‐13,,36.0461979,139.8151537
千葉県野田市宮崎101‐1,,35.9542516,139.8699369
千葉県野田市山崎字下里1134-1番地,,35.92783,139.8835
千葉県野田市野田市山崎1778−1,,35.9271183,139.8915922
千葉県我孫子市我孫子市東我孫子1−9ｰ31,,35.8680168,140.0462022
千葉県野田市蕃昌338−2,,35.9786932,139.8585662
千葉県野田市千葉県野田市横内164−7,,35.9534658,139.8809032
千葉県茂原市下永吉787番地,,35.4118579,140.3078155
千葉県茂原市高師555番地28,,35.428933,140.3083759
千葉県茂原市茂原1016番地,,35.4249897,140.2902698
千葉県茂原市高師864番地1,,35.4284664,140.2978434
千葉県茂原市東茂原13番地21,,35.4140968,140.3172652
千葉県茂原市押日字西之谷595番地67,,35.4488343,140.2746824
千葉県茂原市茂原市緑ヶ丘1丁目48番地11,,35.4374135,140.2610114
千葉県成田市中台1‐5,,35.7834737,140.2911684
千葉県成田市長沼495‐3,,35.8369615,140.3053603
千葉県成田市松崎2163‐1,,35.8055864,140.2861272
千葉県成田市橋賀台2‐23‐1,,35.7751944,140.2880001
千葉県成田市赤荻1042,,35.807411,140.3333419
千葉県成田市中台3‐5,,35.7808234,140.2985283
千葉県成田市吾妻2‐7,,35.783166,140.2869264
千葉県成田市加良部4‐24,,35.7754331,140.3023961
千葉県成田市玉造3‐3,,35.7912298,140.2869264
千葉県成田市三里塚191,,35.7450155,140.377423
千葉県成田市宗吾2‐276,,35.7624842,140.2803805
千葉県成田市大室766‐2,,35.8374962,140.3758123
千葉県成田市上町711‐4,,35.7808555,140.3169025
千葉県成田市三里塚263‐15,,35.7449392,140.3748413
千葉県成田市寺台560,,35.7855608,140.3248997
千葉県成田市公津の杜2‐24‐1,,35.7604242,140.2997572
千葉県成田市大和田156,,35.8810468,140.3611364
千葉県成田市名古屋1144‐1,,35.8557098,140.3614765
千葉県成田市西大須賀1872‐4,,35.8627265,140.3360481
千葉県成田市一坪田406‐1,,35.8186151,140.4235635
千葉県成田市赤坂2‐1‐1,,35.7780075,140.2938072
千葉県成田市本三里塚4番地18,,35.7606943,140.3669153
千葉県成田市成田市大袋379,,35.7622416,140.284993
千葉県成田市成田市郷部1414−2,,35.7884521,140.3057403
千葉県成田市成田市並木町141−3,,35.7570238,140.3127488
千葉県成田市成田市西三里塚248−9,,35.746737,140.3669355
千葉県成田市成田市大袋356−1,,35.7629165,140.2879873
千葉県成田市成田市並木町175−34,,35.7575527,140.304592
千葉県成田市成田市囲護台3−6−10,,35.779557,140.3102505
千葉県成田市成田市囲護台3?6?4,,35.7796687,140.3102735
千葉県成田市成田市花�葡ｬ828−11ｽｶｲﾀｳﾝ成田203,,35.7766588,140.3187418
千葉県成田市成田市公津の杜3−33−10,,35.7543307,140.2981456
千葉県成田市成田市不動ヶ岡2118−5,,35.7737642,140.3118551
千葉県成田市成田市並木町145−124,,35.7551422,140.3092661
千葉県成田市成田市加良部4−9−1,,35.7747471,140.3046323
千葉県成田市成田市押畑896−2玲光苑内2階,,35.801421,140.307173
千葉県佐倉市鏑木町1‐5-3,,35.7148375,140.2249399
千葉県佐倉市西志津2‐23‐19,,35.7142837,140.1338392
千葉県佐倉市本町54,,35.7192852,140.2480102
千葉県佐倉市千成三丁目4番3号,,35.7248195,140.2449081
千葉県佐倉市鏑木町198‐3,,35.7164889,140.2320486
千葉県佐倉市臼井田2379,,35.7361861,140.1840156
千葉県佐倉市西志津4‐26‐1,,35.7134191,140.1412136
千葉県佐倉市大崎台4‐3‐2,,35.7042867,140.2186524
千葉県佐倉市井野869‐9,,35.7281061,140.1463639
千葉県佐倉市中志津7‐1‐10,,35.7053742,140.1513727
千葉県佐倉市馬渡818‐2,,35.6696336,140.2167174
千葉県佐倉市臼井台1201,,35.7341107,140.174304
千葉県佐倉市下志津原61-2,,35.6984147,140.159257
千葉県佐倉市臼井台1351‐4,,35.7253848,140.1898187
千葉県佐倉市染井野1‐21,,35.7208331,140.1943437
千葉県佐倉市上座1219‐4,,35.7243029,140.1620552
千葉県佐倉市上座383‐1,,35.7221769,140.1573202
千葉県佐倉市上志津1704‐6,,35.7127752,140.1461712
千葉県佐倉市白銀1‐24‐5,,35.7116511,140.2499198
千葉県佐倉市王子台4‐10‐1,,35.725912,140.1832978
千葉県佐倉市宮ﾉ台3‐1‐1,,35.7407026,140.1483413
千葉県佐倉市吉見193‐1,,35.7112636,140.1935782
千葉県佐倉市山王1‐9-8,,35.685274,140.2060562
千葉県佐倉市井野972‐2,,35.7329133,140.1421363
千葉県佐倉市岩名961番2,,35.7378542,140.2196516
千葉県佐倉市上志津1656−9,,35.7171569,140.1438735
千葉県佐倉市本町142番地1,,35.7206632,140.2418153
千葉県佐倉市江原新田103,,35.7265136,140.2012794
千葉県佐倉市上座700,,35.7266974,140.1585785
千葉県佐倉市寺崎北2−13−1,,35.7092651,140.2188499
千葉県佐倉市上志津原351−8,,35.7019284,140.1482971
千葉県佐倉市西ﾕｰｶﾘが丘6−12−3,,35.7263885,140.1505753
千葉県佐倉市王子台1−23,,35.7309922,140.183895
千葉県佐倉市南ﾕｰｶﾘが丘1番地1 T205,,35.721242,140.156175
千葉県佐倉市上志津1663番地,,35.7175723,140.1445742
千葉県佐倉市臼井1239番地1,,35.7351561,140.1867463
千葉県佐倉市ﾕｰｶﾘが丘4−8−6,,35.7225979,140.1569095
千葉県東金市東金194‐2,,35.5556016,140.3574176
千葉県東金市田間788‐2,,35.5708743,140.3765759
千葉県東金市前之内6‐1,,35.5703018,140.395498
千葉県東金市関内724,,35.5678923,140.4177762
千葉県東金市砂古瀬476‐1,,35.5139788,140.3801463
千葉県東金市幸田680‐1,,35.5470734,140.380031
千葉県東金市八坂台三丁目1756番地14,,35.5712875,140.357449
千葉県東金市東金市東岩崎25−4 大野ﾋﾞﾙ,,35.5564273,140.3676817
千葉県東金市東金市家徳221−9,,35.5475718,140.392855
千葉県東金市東金市東金1321−4,,35.5579794,140.3547763
千葉県東金市東金市東金1391−2,,35.5600307,140.3589501
千葉県東金市東金市東岩崎25−4 大野ﾋﾞﾙ2F,,35.5564273,140.3676817
千葉県東金市東金市東新宿10−16,,35.5602539,140.3693354
千葉県東金市東金市東岩崎2−10,,35.5603945,140.3654363
千葉県旭市ﾆの6544,,35.7214348,140.598639
千葉県旭市後草1516,,35.7317155,140.6757278
千葉県旭市井戸野2396,,35.7085467,140.6149157
千葉県旭市野中4545,,35.7024578,140.6717961
千葉県旭市中谷里3366,,35.6956306,140.6346802
千葉県旭市新町771‐1,,35.7418404,140.6362195
千葉県旭市ﾊの58‐6,,35.7156676,140.6527492
千葉県旭市鎌数9401‐3,,35.7228306,140.6064934
千葉県旭市江ｹ崎1057,,35.7338383,140.6535596
千葉県旭市ﾆの2390,,35.7178664,140.6427822
千葉県旭市ｲの1835,,35.7232467,140.6590907
千葉県旭市ﾛの245-3,,35.7186003,140.6559705
千葉県旭市萬歳356,,35.7830559,140.6515336
千葉県旭市鏑木1966,,35.755506,140.586333
千葉県旭市入野2170‐5,,35.7701675,140.6230297
千葉県旭市岩井196,,35.758215,140.687281
千葉県旭市江ｹ崎12‐2,,35.7335815,140.6699052
千葉県旭市蛇園5354,,35.7355959,140.7015305
千葉県旭市飯岡2115‐2,,35.698528,140.7279478
千葉県旭市荻園1752‐1,,35.7060183,140.7116689
千葉県旭市飯岡2126−1,,35.6973049,140.7266439
千葉県習志野市東習志野3‐4‐1,,35.690722,140.0721768
千葉県習志野市谷津5‐20‐5,,35.6898201,140.0093142
千葉県習志野市東習志野2‐13‐2,,35.6936256,140.0696577
千葉県習志野市藤崎3‐2‐19,,35.6925421,140.0335227
千葉県習志野市谷津2‐20‐2,,35.6812131,140.0116274
千葉県習志野市大久保2‐7‐7,,35.6869816,140.0514525
千葉県習志野市鷺沼1‐14‐16,,35.6751492,140.0244629
千葉県習志野市本大久保4‐5‐1,,35.6814851,140.0509598
千葉県習志野市津田沼3‐11‐10,,35.6856474,140.0256607
千葉県習志野市秋津3‐8‐1,,35.6695774,140.0153827
千葉県習志野市谷津3‐1‐13,,35.6824907,140.0064575
千葉県習志野市本大久保2‐3‐15,,35.6832005,140.0405647
千葉県習志野市香澄4‐1‐1,,35.6678186,140.0214505
千葉県習志野市奏の杜2‐1‐1奏の杜ﾌｫﾙﾃ2階,,35.6895254,140.0157176
千葉県習志野市奏の杜2−19−5,,35.6907077,140.0119081
千葉県習志野市習志野市奏の杜1−3−31,,35.6903503,140.0155772
千葉県習志野市谷津2丁目5番6号,,35.6820912,140.0159181
千葉県習志野市習志野市奏の杜3−14−9,,35.686324,140.013915
千葉県習志野市習志野市津田沼2−9−1,,35.6875716,140.0230386
千葉県習志野市東習志野6−7−2,,35.7004806,140.0659314
千葉県習志野市藤崎6−6−13,,35.6885384,140.0419292
千葉県習志野市津田沼4−6−6,,35.683224,140.0208507
千葉県習志野市津田沼3丁目15番20号,,35.6852924,140.0282304
千葉県習志野市本大久保4丁目1番4号,,35.6830534,140.0482685
千葉県習志野市泉町3−2−1,,35.693226,140.0555512
千葉県習志野市香澄4−6−1,,35.6655929,140.0271375
千葉県習志野市習志野市東習志野2−10−3,,35.6931004,140.0684559
千葉県習志野市習志野市大久保1−20−19ｴｽﾀｼｵ1F,,35.6867463,140.047787
千葉県習志野市習志野市実籾5−5−18,,35.6903329,140.0690418
千葉県習志野市千葉県習志野市本大久保4丁目12番3号 ﾊﾟﾙﾃｰﾙ習志野B号室,,35.6846299,140.0492736
千葉県習志野市千葉県習志野市奏の杜1‐12‐13 ﾌﾛｰﾚﾝｽ奏の杜1F,,35.6908187,140.0133915
千葉県習志野市千葉県習志野市津田沼4−11−11 小倉第一ﾋﾞﾙ1F,,35.6841401,140.019418
千葉県習志野市千葉県習志野市大久保1−21−14 琴富ﾋﾞﾙ2階C号室,,35.6866867,140.0480839
千葉県習志野市千葉県習志野市奏の杜2−17−10 West奏の杜,,35.6900213,140.0112665
千葉県柏市十余二287‐270,,35.8855237,139.9695788
千葉県柏市松葉町3‐15‐1,,35.8874197,139.9690248
千葉県柏市旭町1‐6‐14,,35.8612545,139.9688429
千葉県柏市桜台9‐6,,35.8612304,139.9810949
千葉県柏市若葉町4‐36,,35.8528306,139.9730249
千葉県柏市あけぼの3‐4‐18,,35.8687298,139.9719185
千葉県柏市布施834‐1,,35.8878572,139.992457
千葉県柏市東中新宿4‐5‐24,,35.8308366,139.9603607
千葉県柏市豊四季台2‐1‐120,,35.8630685,139.9603432
千葉県柏市増尾6‐6‐1,,35.8289838,139.9807792
千葉県柏市豊住3‐1‐43,,35.8386361,139.9638041
千葉県柏市逆井1305‐2,,35.8123574,139.9758284
千葉県柏市西原1‐4‐20,,35.898129,139.9161313
千葉県柏市豊四季698‐28,,35.8468043,139.9625242
千葉県柏市豊四季126‐2,,35.8666789,139.9337258
千葉県柏市酒井根4丁目10番33号,,35.8201566,139.9602548
千葉県柏市名戸ｹ谷683‐1,,35.8461383,139.9836292
千葉県柏市正連寺100,,35.9029765,139.9556659
千葉県柏市旭町5‐3‐25,,35.8562566,139.9609854
千葉県柏市東2‐1‐27,,35.8574103,139.9823564
千葉県柏市根戸416‐67,,35.8822515,139.9861778
千葉県柏市篠篭田1275‐5,,35.8729268,139.9563289
千葉県柏市松葉町4‐11,,35.8893708,139.971943
千葉県柏市高柳1503‐9,,35.8079238,140.0005813
千葉県柏市しいの木台5‐31‐2,,35.8058581,139.9831381
千葉県柏市十余二175‐42,,35.8886766,139.9406549
千葉県柏市大青田1507‐8,,35.914067,139.9402622
千葉県柏市大室1285番地の12,,35.9011632,139.9675352
千葉県柏市南柏中央6‐5ｸｨｰﾝﾋﾞﾙ1･2階,,35.8437515,139.9549229
千葉県柏市大津ｹ丘3‐3‐2,,35.8379638,139.9987397
千葉県柏市柏3‐10‐28,,35.8622343,139.9756056
千葉県柏市若柴173‐8柏の葉ｷｬﾝﾊﾟｽ151街区1F,,35.8932343,139.9542624
千葉県柏市高柳1337‐2,,35.8138003,139.9998797
千葉県柏市豊平町11‐18,,35.8551918,139.956173
千葉県柏市逆井1377‐1,,35.8142779,139.9738543
千葉県柏市北柏3‐2‐5,,35.8745489,139.987513
千葉県柏市東中新宿3‐23‐1,,35.8322495,139.9647705
千葉県柏市若柴277‐6柏の葉ｷｬﾝﾊﾟｽ二番街ｺﾓﾝD棟,,35.8608146,139.9717297
千葉県柏市東中新宿3‐23‐10,,35.8320745,139.9647755
千葉県柏市千葉県柏市正連寺434−26 中央128街区1,,35.9001757,139.9480448
千葉県柏市豊四季336−5,,35.8563725,139.9483252
千葉県柏市亀甲台町2−13−12,,35.8463962,139.9806392
千葉県柏市加賀3−23−6,,35.8300353,139.9757299
千葉県柏市旭町1-6-1,,35.8615216,139.9695688
千葉県柏市千葉県柏市逆井5−15−19,,35.8192016,139.9835249
千葉県柏市若柴276-1 中央161街区6,,35.8913412,139.9515986
千葉県柏市千葉県柏市若柴175 ららぽｰと柏の葉1F,,35.8939975,139.9512925
千葉県柏市千葉県柏市高柳2−6−4,,35.808963,139.9959503
千葉県柏市若柴280−10中央171街区3,,35.8889721,139.9508265
千葉県柏市若葉町7−17,,35.853108,139.9709731
千葉県柏市五條谷423−5,,35.8470208,140.0199998
千葉県柏市東3−2−5,,35.8544165,139.9812491
千葉県柏市小青田3-6-18,,35.914531,139.9574608
千葉県柏市若柴178番地4 柏の葉ｷｬﾝﾊﾟｽ148街区1A,,35.8958347,139.9516699
千葉県柏市柏3−11−27,,35.8607764,139.976421
千葉県柏市旭町7−4−58,,35.8588814,139.955806
千葉県柏市千葉県柏市高柳1498−1,,35.8070586,140.0021048
千葉県柏市十余二287−273,,35.8851703,139.9689176
千葉県柏市十余二248−126,,35.8804862,139.9601429
千葉県柏市豊四季台1−3−1,,35.8656165,139.9569319
千葉県勝浦市蟹田91,,35.2013699,140.2750034
千葉県市原市辰巳台東2‐21‐1,,35.5233986,140.15862
千葉県市原市五井5146,,35.5180561,140.0888664
千葉県市原市光風台3‐162,,35.4479014,140.1061639
千葉県市原市国分寺台中央5‐10‐1,,35.5039791,140.1196885
千葉県市原市辰巳台東3‐11,,35.5158909,140.1530195
千葉県市原市八幡1050‐1,,35.5374466,140.116576
千葉県市原市姉崎2150‐1,,35.4713677,140.0457609
千葉県市原市皆吉959,,35.3957042,140.138994
千葉県市原市馬立717,,35.425517,140.1127198
千葉県市原市鶴舞701‐3,,35.3845122,140.1806749
千葉県市原市徳氏108,,35.3192759,140.1480742
千葉県市原市養老952,,35.3542491,140.1523148
千葉県市原市五井5470,,35.521446,140.0895813
千葉県市原市辰巳台東2‐1,,35.5208759,140.1568781
千葉県市原市海土有木269‐2,,35.4657221,140.1257137
千葉県市原市若宮3‐4‐4,,35.5286229,140.1338207
千葉県市原市ちはら台南2‐15‐8,,35.5250401,140.1785921
千葉県市原市根田878,,35.5023838,140.1028401
千葉県市原市白塚448,,35.4869146,140.0675862
千葉県市原市瀬又字傾城谷507,,35.5392835,140.2066184
千葉県市原市島野475,,35.4954806,140.0769914
千葉県市原市五井中央東1−11−19,,35.51051,140.0906976
千葉県市原市国分寺台中央4−8−4,,35.502533,140.1201913
千葉県市原市ちはら台南1丁目1番10,,35.5286437,140.1762953
千葉県市原市市原市ちはら台西2−3−8,,35.5326176,140.1714697
千葉県市原市五所1986−5,,35.534675,140.112872
千葉県市原市姉崎2611,,35.4766888,140.0604624
千葉県市原市潤井戸字上潤ｹ台2272−4,,35.5175477,140.170385
千葉県市原市五井中央西1-31-24,,35.5130667,140.0874611
千葉県市原市ちはら台西四丁目2番地9,,35.5313925,140.1733153
千葉県市原市五井西6丁目38番地22,,35.5124645,140.0659893
千葉県市原市五井中央西1-31-42,,35.5130667,140.0874611
千葉県市原市辰巳台西1丁目2番地31,,35.5228969,140.1502829
千葉県市原市若宮2丁目22番地4,,35.5289544,140.1322637
千葉県市原市ちはら台南6−1−12,,35.5287556,140.1850411
千葉県市原市,,35.4978821,140.1148672
千葉県市原市,,35.4978821,140.1148672
千葉県市原市,,35.4978821,140.1148672
千葉県市原市,,35.4978821,140.1148672
千葉県市原市,,35.4978821,140.1148672
千葉県市原市千葉県市原市五井5119−1,,35.5159949,140.0882502
千葉県市原市千葉県市原市青柳676,,35.5049624,140.0636425
千葉県市原市国分寺台中央3−12−8,,35.5002113,140.12015
千葉県市原市市原市荻作442-1,,35.5047104,140.1588276
千葉県市原市市原市八幡1245−1,,35.538481,140.1191292
千葉県流山市中野久木373,,35.8951088,139.9000066
千葉県流山市平和台2‐6‐3,,35.854057,139.9038246
千葉県流山市江戸川台東3‐5,,35.9000719,139.9128353
千葉県流山市向小金3‐102‐1,,35.8396562,139.9503398
千葉県流山市東深井177‐2,,35.9093491,139.9088921
千葉県流山市南流山7‐5‐1,,35.841454,139.8964956
千葉県流山市おおたかの森東4丁目99番地の4,,35.8713868,139.9324125
千葉県流山市駒木台118‐1,,35.8875622,139.9309426
千葉県流山市名都借464,,35.8517923,139.9406615
千葉県流山市大畔198,,35.8711592,139.910624
千葉県流山市加4‐12,,35.8622471,139.9040192
千葉県流山市南流山1‐17‐4,,35.8381116,139.9075172
千葉県流山市南流山2‐29‐4,,35.8352542,139.9007417
千葉県流山市流山9‐500‐42,,35.8485936,139.9015666
千葉県流山市駒木474,,35.8767626,139.9387955
千葉県流山市上新宿字芝山111‐8,,35.8858894,139.9072214
千葉県流山市おおたかの森東1-10-3,,35.8734159,139.9278555
千葉県流山市野々下1‐292,,35.8613034,139.9258778
