埼玉県さいたま市さいたま市岩槻区愛宕町4−21,,35.9540834,139.6961829
埼玉県さいたま市さいたま市浦和区本太4−10−2,,35.8670998,139.6573041
埼玉県さいたま市さいたま市浦和区瀬ｹ崎2−16−5,,35.878464,139.6622791
埼玉県さいたま市西大宮4−1−4,,35.9319855,139.5826622
埼玉県さいたま市三橋6−654−2,,35.9168874,139.5914127
埼玉県さいたま市宮前町1238,,35.9259394,139.5963103
埼玉県さいたま市宮原町4−940−3,,35.9452737,139.6107865
埼玉県さいたま市今羽町650−3,,35.9508621,139.6254014
埼玉県さいたま市上小町1146−2,,35.8983175,139.6150741
埼玉県さいたま市大和田町1−1780,,35.924777,139.6477598
埼玉県さいたま市東大宮5−26−1,,35.948181,139.6420211
埼玉県さいたま市本町東6−109−3,,35.8926679,139.6177969
埼玉県さいたま市本町東1−14−5,,35.8799853,139.6262943
埼玉県さいたま市上木崎7−612−4,,35.8895258,139.6496729
埼玉県さいたま市前地3−3,,35.8590911,139.6641024
埼玉県さいたま市元町2−186−2,,35.8727658,139.6534992
埼玉県さいたま市南浦和1−599−11,,35.8523032,139.6694446
埼玉県さいたま市大間木2−13−5,,35.877712,139.6902895
埼玉県さいたま市大間木783,,35.8641736,139.7102847
埼玉県さいたま市大間木783,,35.8641736,139.7102847
埼玉県さいたま市大谷口764−1,,35.8667843,139.6780319
埼玉県さいたま市西大宮3−9−3,,35.9245602,139.5764834
埼玉県さいたま市西大宮3−19−6,,35.9269409,139.5800758
埼玉県さいたま市西大宮3−61−7,,35.9309482,139.580932
埼玉県さいたま市指扇1379−1,,35.9153628,139.5802711
埼玉県さいたま市大成町4−453−2,,35.9240533,139.6127581
埼玉県さいたま市日進町3−150−2,,35.9368064,139.6070227
埼玉県さいたま市土呂町2−9−10,,35.9310525,139.632694
埼玉県さいたま市東町1−222−1,,35.9056727,139.6344699
埼玉県さいたま市風渡野633−3,,35.936909,139.6678732
埼玉県さいたま市東大宮2−22−13,,35.9469612,139.6370997
埼玉県さいたま市上落合8−1−20,,35.8989703,139.6245753
埼玉県さいたま市西堀1−1999−1,,35.8561465,139.6351474
埼玉県さいたま市常盤2−108−1,,35.8649718,139.6519048
埼玉県さいたま市南浦和,,35.8487532,139.6719963
埼玉県さいたま市沼影1−10−1,,35.8441443,139.646947
埼玉県さいたま市鹿手袋4−14−14,,35.8473008,139.6415083
埼玉県さいたま市東浦和5−27−4,,35.8844293,139.6649994
埼玉県さいたま市美園3−17−6,,35.8982922,139.7259762
埼玉県さいたま市美園5−48−1,,35.8915478,139.7330052
埼玉県さいたま市美園東1−12−5,,35.8990214,139.7352553
埼玉県さいたま市,,35.8616486,139.6454782
埼玉県さいたま市,,35.8616486,139.6454782
埼玉県さいたま市,,35.8616486,139.6454782
埼玉県さいたま市,,35.8616486,139.6454782
埼玉県さいたま市,,35.8616486,139.6454782
埼玉県さいたま市,,35.8616486,139.6454782
埼玉県さいたま市,,35.8616486,139.6454782
埼玉県さいたま市,,35.8616486,139.6454782
埼玉県さいたま市,,35.8616486,139.6454782
埼玉県さいたま市,,35.8616486,139.6454782
埼玉県さいたま市,,35.8616486,139.6454782
埼玉県さいたま市,,35.8616486,139.6454782
埼玉県さいたま市,,35.8616486,139.6454782
埼玉県さいたま市,,35.8616486,139.6454782
埼玉県さいたま市,,35.8616486,139.6454782
埼玉県さいたま市,,35.8616486,139.6454782
埼玉県さいたま市,,35.8616486,139.6454782
埼玉県さいたま市,,35.8616486,139.6454782
埼玉県さいたま市,,35.8616486,139.6454782
埼玉県さいたま市,,35.8616486,139.6454782
埼玉県さいたま市,,35.8616486,139.6454782
埼玉県さいたま市,,35.8616486,139.6454782
埼玉県さいたま市,,35.8616486,139.6454782
埼玉県さいたま市,,35.8616486,139.6454782
埼玉県さいたま市,,35.8616486,139.6454782
埼玉県さいたま市,,35.8616486,139.6454782
埼玉県さいたま市,,35.8616486,139.6454782
埼玉県さいたま市,,35.8616486,139.6454782
埼玉県さいたま市,,35.8616486,139.6454782
埼玉県さいたま市,,35.8616486,139.6454782
埼玉県さいたま市,,35.8616486,139.6454782
埼玉県さいたま市,,35.8616486,139.6454782
埼玉県さいたま市,,35.8616486,139.6454782
埼玉県さいたま市,,35.8616486,139.6454782
埼玉県さいたま市,,35.8616486,139.6454782
埼玉県さいたま市,,35.8616486,139.6454782
埼玉県さいたま市,,35.8616486,139.6454782
埼玉県さいたま市,,35.8616486,139.6454782
埼玉県さいたま市,,35.8616486,139.6454782
埼玉県さいたま市,,35.8616486,139.6454782
埼玉県さいたま市,,35.8616486,139.6454782
埼玉県さいたま市,,35.8616486,139.6454782
埼玉県さいたま市,,35.8616486,139.6454782
埼玉県さいたま市,,35.8616486,139.6454782
埼玉県さいたま市,,35.8616486,139.6454782
埼玉県さいたま市,,35.8616486,139.6454782
埼玉県さいたま市,,35.8616486,139.6454782
埼玉県さいたま市,,35.8616486,139.6454782
埼玉県さいたま市,,35.8616486,139.6454782
埼玉県さいたま市,,35.8616486,139.6454782
埼玉県さいたま市,,35.8616486,139.6454782
埼玉県さいたま市,,35.8616486,139.6454782
埼玉県さいたま市,,35.8616486,139.6454782
埼玉県さいたま市,,35.8616486,139.6454782
埼玉県さいたま市,,35.8616486,139.6454782
埼玉県さいたま市,,35.8616486,139.6454782
埼玉県さいたま市,,35.8616486,139.6454782
埼玉県さいたま市,,35.8616486,139.6454782
埼玉県さいたま市,,35.8616486,139.6454782
埼玉県さいたま市,,35.8616486,139.6454782
埼玉県さいたま市,,35.8616486,139.6454782
埼玉県さいたま市,,35.8616486,139.6454782
埼玉県さいたま市,,35.8616486,139.6454782
埼玉県さいたま市,,35.8616486,139.6454782
埼玉県さいたま市,,35.8616486,139.6454782
埼玉県さいたま市,,35.8616486,139.6454782
埼玉県さいたま市,,35.8616486,139.6454782
埼玉県さいたま市,,35.8616486,139.6454782
埼玉県さいたま市,,35.8616486,139.6454782
埼玉県さいたま市,,35.8616486,139.6454782
埼玉県さいたま市,,35.8616486,139.6454782
埼玉県さいたま市,,35.8616486,139.6454782
埼玉県さいたま市,,35.8616486,139.6454782
埼玉県さいたま市,,35.8616486,139.6454782
埼玉県さいたま市,,35.8616486,139.6454782
埼玉県さいたま市,,35.8616486,139.6454782
埼玉県さいたま市,,35.8616486,139.6454782
埼玉県さいたま市,,35.8616486,139.6454782
埼玉県さいたま市,,35.8616486,139.6454782
埼玉県さいたま市,,35.8616486,139.6454782
埼玉県さいたま市,,35.8616486,139.6454782
埼玉県さいたま市,,35.8616486,139.6454782
埼玉県さいたま市,,35.8616486,139.6454782
埼玉県さいたま市,,35.8616486,139.6454782
埼玉県さいたま市,,35.8616486,139.6454782
埼玉県さいたま市,,35.8616486,139.6454782
埼玉県さいたま市,,35.8616486,139.6454782
埼玉県さいたま市,,35.8616486,139.6454782
埼玉県さいたま市,,35.8616486,139.6454782
埼玉県さいたま市,,35.8616486,139.6454782
埼玉県さいたま市,,35.8616486,139.6454782
埼玉県さいたま市,,35.8616486,139.6454782
埼玉県さいたま市,,35.8616486,139.6454782
埼玉県さいたま市,,35.8616486,139.6454782
埼玉県さいたま市,,35.8616486,139.6454782
埼玉県さいたま市,,35.8616486,139.6454782
埼玉県さいたま市,,35.8616486,139.6454782
埼玉県さいたま市,,35.8616486,139.6454782
埼玉県さいたま市,,35.8616486,139.6454782
埼玉県さいたま市,,35.8616486,139.6454782
埼玉県さいたま市,,35.8616486,139.6454782
埼玉県さいたま市,,35.8616486,139.6454782
埼玉県さいたま市,,35.8616486,139.6454782
埼玉県さいたま市,,35.8616486,139.6454782
埼玉県さいたま市,,35.8616486,139.6454782
埼玉県さいたま市,,35.8616486,139.6454782
埼玉県さいたま市,,35.8616486,139.6454782
埼玉県さいたま市,,35.8616486,139.6454782
埼玉県さいたま市府内2−27−48,,35.9426983,139.7140835
埼玉県さいたま市桜木町2-172,,35.9076604,139.6205234
埼玉県さいたま市下落合1030,,35.8856242,139.6366218
埼玉県さいたま市本町5-11-37,,35.9527346,139.7014493
埼玉県さいたま市三橋ｰ1067ｰ3,,35.9016648,139.6018654
埼玉県さいたま市指扇3615,,35.9218085,139.5804045
埼玉県さいたま市宮原町3-167,,35.9374819,139.6134333
埼玉県さいたま市大門町3-118ｰ1,,35.9083044,139.6297494
埼玉県さいたま市土呂町1-25-4,,35.9336084,139.6299664
埼玉県さいたま市東大宮5-35-6,,35.9482391,139.6439756
埼玉県さいたま市田島2-17-11,,35.8445206,139.6310202
埼玉県さいたま市常盤9-19-4,,35.8701745,139.6458568
埼玉県さいたま市高砂2-11-14,,35.8584943,139.6535974
埼玉県さいたま市針ヶ谷3-6-4,,35.8840735,139.6408055
埼玉県さいたま市南本町2-12-3,,35.8473606,139.6674313
埼玉県さいたま市別所1-24-15,,35.8494953,139.649361
埼玉県さいたま市関1-6-3,,35.8524941,139.6369047
埼玉県さいたま市鹿手袋4-4-6,,35.8491696,139.6397879
埼玉県さいたま市天沼町2-154-13,,35.9033271,139.6377636
埼玉県さいたま市小深作176,,35.9386606,139.6635244
埼玉県さいたま市岸町4−26−23,,35.8563989,139.6550688
埼玉県さいたま市根岸4−4−17,,35.8429945,139.660415
埼玉県さいたま市日進町2−1059−1,,35.9289661,139.6059546
埼玉県さいたま市宮原町3−587,,35.938248,139.6088452
埼玉県さいたま市宮原町3−587,,35.938248,139.6088452
埼玉県さいたま市仲町2−16−5,,35.8581869,139.650779
埼玉県さいたま市美園4−11−8,,35.8938557,139.7283179
埼玉県川越市砂909−11,,35.890604,139.4973338
埼玉県川越市南大塚3−10−22,,35.890694,139.4609387
埼玉県川越市的場2244−2,,35.9262778,139.4418982
埼玉県所沢市小手指町5−16−5,,35.7945033,139.4390148
埼玉県所沢市小手指町5−13−35,,35.7949398,139.4392587
埼玉県鶴ヶ島市富士見二丁目24番27号,,35.9492153,139.4140408
埼玉県狭山市狭山台4-36,,35.8512391,139.4351628
神奈川県大和市深見台1−7−2,,35.4656564,139.467327
神奈川県大和市大和南1−16−25,,35.4683704,139.4672773
神奈川県大和市つきみ野5−8−6,,35.5108392,139.4580464
神奈川県大和市中央林間5−1−20,,35.5092954,139.4438302
神奈川県大和市下和田1248−2,,35.4295298,139.468211
神奈川県大和市大和東3−15−5,,35.4745023,139.462311
神奈川県大和市大和東3−3−16,,35.4721283,139.4638555
神奈川県大和市中央2−6−17,,35.4481505,139.3940376
神奈川県大和市渋谷7−1−6,,35.4316292,139.4663039
神奈川県大和市西鶴間1−8−2,,35.491951,139.4484374
神奈川県大和市中央林間6−2−12,,35.5104496,139.4445352
神奈川県大和市中央2−16−17 2F,,35.4875153,139.4579975
神奈川県大和市上和田1800−3,,35.4469902,139.4668718
神奈川県横浜市潮田町3−137−5,,35.5030064,139.689062
神奈川県横浜市市場東中町12−27,,35.5198395,139.6837301
神奈川県横浜市西大口93,,35.4904725,139.6370598
神奈川県横浜市吉浜町1−6,,35.4392008,139.6426786
神奈川県横浜市井土ｹ谷上町26−24,,35.4306844,139.5979242
神奈川県横浜市六ﾂ川2−68−18,,35.4209057,139.5814514
神奈川県横浜市丸山台1−5−9,,35.401975,139.573922
神奈川県横浜市新桜ｹ丘2−41−9,,35.4548419,139.5636286
神奈川県横浜市さちが丘52−7,,35.4602366,139.527274
神奈川県横浜市白根2−3−18,,35.4799552,139.5568293
神奈川県横浜市上白根2−9−18,,35.4915041,139.5394849
神奈川県横浜市上白根町1306−28,,35.5030761,139.5309031
神奈川県横浜市二俣川1−6−1,,35.4634559,139.531114
神奈川県横浜市東希望が丘240−4,,35.4672279,139.5066515
神奈川県横浜市若葉台2−14−1,,35.5085992,139.5002195
神奈川県横浜市磯子4−3−11,,35.408885,139.6197488
神奈川県横浜市洋光台3−18−26,,35.3808576,139.5964754
神奈川県横浜市西柴3−31−1,,35.3498867,139.6286124
神奈川県横浜市六浦東3−12−1,,35.3178123,139.6161245
神奈川県横浜市箕輪町2−2−12,,35.5473947,139.6446784
神奈川県横浜市台村町633,,35.5107806,139.5306684
神奈川県横浜市あざみ野1−32−6,,35.5734978,139.5501291
神奈川県横浜市あざみ野3−11−27,,35.5684435,139.5413209
神奈川県相模原市相模台団地5−8,,35.5176268,139.411163
神奈川県相模原市橋本5−30ｰ23,,35.6001896,139.3424877
神奈川県相模原市共和1−4−3,,35.5665192,139.3984425
神奈川県相模原市橋本1−3−7,,35.5912066,139.3467954
神奈川県相模原市橋本2−6−26,,35.5963305,139.3413637
神奈川県相模原市西橋本5−2−15,,35.5966357,139.3368618
神奈川県相模原市相模大野7−3−3,,35.5329436,139.4391405
神奈川県相模原市相模原4−8−6,,35.5783011,139.3762216
神奈川県相模原市上鶴間4−26−4,,35.517878,139.4479921
神奈川県相模原市宮下3−16,,35.5941969,139.3595244
神奈川県相模原市与瀬886−7,,35.6144378,139.1895303
神奈川県綾瀬市寺尾台1−12−60,,35.4577645,139.4215891
神奈川県綾瀬市寺尾西3−11−1,,35.4549201,139.4175739
神奈川県綾瀬市吉岡1526,,35.4259655,139.418288
神奈川県綾瀬市寺尾西1−13−1,,35.451308,139.4212262
神奈川県横浜市青葉台1−18−13,,35.546825,139.5186947
神奈川県横浜市中川1−1−1,,35.5629836,139.5697367
神奈川県横浜市柏尾町909−1,,35.4162085,139.5470885
神奈川県横浜市品濃町1466−1,,35.4389162,139.5542161
神奈川県横浜市品濃町1024,,35.4365051,139.5519281
神奈川県横浜市領家1−10,,35.4219393,139.5248178
神奈川県横浜市阿久和西2−28−13,,35.4531791,139.5009487
神奈川県横浜市瀬谷4−25−2,,35.4685456,139.4812242
神奈川県横浜市浜町1−1−1,,35.5009336,139.6924536
神奈川県横浜市亀住町4−11,,35.483209,139.6403618
神奈川県横浜市久保町3−13,,35.4509802,139.6080483
神奈川県横浜市桜木町7−42,,35.4590985,139.6228001
神奈川県横浜市井土ｹ谷中町161,,35.433964,139.6012083
神奈川県横浜市南太田2−7−21,,35.4356802,139.6085698
神奈川県横浜市睦町1−30,,35.4304677,139.6172801
神奈川県横浜市丸山台1−2−1,,35.4015274,139.5736075
神奈川県横浜市堀口19−3,,35.3580929,139.6289182
神奈川県横浜市並木2−13−2,,35.3621501,139.6395125
神奈川県横浜市篠原町3112−16,,35.5025324,139.6147838
神奈川県横浜市篠原町974−25,,35.5010367,139.6214805
神奈川県横浜市長津田4−12,,35.5321199,139.4931685
神奈川県横浜市美しが丘1−1−2,,35.5776088,139.5589156
神奈川県横浜市牛久保西2−28−1,,35.558043,139.5778893
神奈川県横浜市宿町4−75−1,,35.4296956,139.6084136
神奈川県横浜市新桜ｹ丘1−34−19,,35.4480347,139.5649301
神奈川県横浜市森2−13−16,,35.3957918,139.6136816
神奈川県横浜市和泉中央北2−36−66,,35.4185969,139.5001052
神奈川県横浜市和泉町1368,,35.4028529,139.4914593
神奈川県横浜市鶴見中央3−10,,35.5109894,139.6869897
神奈川県横浜市みなとみらい4−7,,35.4594708,139.6302265
神奈川県横浜市寿町3−12−1,,35.4386649,139.6387933
神奈川県横浜市和田1−15−3,,35.4635241,139.5875301
神奈川県横浜市市沢町874−4,,35.4594962,139.5604587
神奈川県横浜市汐見台2−2−1,,35.4045798,139.6119588
神奈川県横浜市東町19−33,,35.4165945,139.6379843
神奈川県横浜市釜利谷東2−16−30,,35.3429365,139.6199037
神奈川県横浜市大倉山3−5−16,,35.520588,139.6296288
神奈川県横浜市綱島西1−2−9,,35.537881,139.6354742
神奈川県横浜市篠原北2−4−9,,35.5100133,139.6296591
神奈川県横浜市篠原北2−4−7,,35.5099449,139.6295591
神奈川県横浜市大倉山1−22−5,,35.5179323,139.6309821
神奈川県横浜市高田東4−22−38,,35.5492013,139.6204395
神奈川県横浜市あかね台2−18−1,,35.5417597,139.4838433
神奈川県横浜市青葉台2−8−27,,35.5440478,139.5146041
神奈川県横浜市荏田町2361−3,,35.5585844,139.5520335
神奈川県横浜市美しが丘2−12−1,,35.5812523,139.560198
神奈川県横浜市品濃町557−1,,35.4337367,139.5623296
神奈川県横浜市原宿4−35−4,,35.3749523,139.5020333
神奈川県横浜市戸塚町4396,,35.3965487,139.5247269
神奈川県横浜市川上町85−1,,35.4302506,139.5544206
神奈川県横浜市戸塚町3417,,35.3938307,139.5268263
神奈川県横浜市戸塚町2833−3,,35.3879619,139.5268082
神奈川県横浜市新橋町812−26,,35.4306492,139.5059944
神奈川県横浜市新橋町812−2,,35.4305839,139.5054748
神奈川県横浜市中田西2−25−30,,35.4076979,139.504028
神奈川県横浜市鶴見中央1−28−2,,35.5084636,139.6788146
神奈川県横浜市鶴見中央1−18−10,,35.5100532,139.6782412
神奈川県横浜市白幡上町10−24,,35.492335,139.6317206
神奈川県横浜市松見町1−10−3,,35.4992873,139.6413835
神奈川県横浜市本牧元町72−1,,35.4169025,139.6655827
神奈川県横浜市寿町4−13−1,,35.4387397,139.6376826
神奈川県横浜市浦舟町3−44−3,,35.4341061,139.6266403
神奈川県横浜市六ﾂ川3−77−7,,35.4279783,139.5805637
神奈川県横浜市庚台48,,35.4398287,139.6130804
神奈川県横浜市上永谷1−35−41,,35.4055092,139.5761568
神奈川県横浜市上大岡西3−10−17,,35.4047035,139.5973145
神奈川県横浜市港南台4−6−15,,35.3717103,139.5741802
神奈川県横浜市権太坂3−1−34,,35.4380191,139.5736582
神奈川県横浜市境木町75−82,,35.4423744,139.564047
神奈川県横浜市常盤台79−1,,35.4741709,139.5932742
神奈川県横浜市鶴ｹ峰2−30−1,,35.4758737,139.550136
神奈川県横浜市笹野台4−11−19,,35.469873,139.5099086
神奈川県横浜市金が谷521,,35.4788278,139.5156927
神奈川県横浜市白根1−14−7,,35.4781364,139.5509898
神奈川県横浜市東希望が丘188−1,,35.4626267,139.5090109
神奈川県横浜市洋光台5−3−18,,35.3763079,139.5938017
神奈川県横浜市富岡東5−19−9,,35.3682062,139.631362
神奈川県横浜市篠原町2823,,35.5050743,139.6213104
神奈川県横浜市樽町3−6−38,,35.5300988,139.6433525
神奈川県横浜市日吉2−9−6,,35.5557366,139.6452883
神奈川県横浜市日吉2−10−4,,35.5561048,139.6450323
神奈川県横浜市青砥町635−22,,35.521029,139.5459545
神奈川県横浜市小山町292,,35.5202143,139.5385404
神奈川県横浜市新治町701,,35.5206261,139.5197869
神奈川県横浜市霧が丘3−25−1,,35.514413,139.5059515
神奈川県横浜市十日市場町1258−86,,35.522267,139.5155197
神奈川県横浜市長津田2−34−12,,35.532032,139.4976
神奈川県横浜市新石川2−9−6,,35.5744683,139.55924
神奈川県横浜市新石川1−13−1,,35.568479,139.555559
神奈川県横浜市千草台32−15,,35.5371888,139.5302155
神奈川県横浜市勝田町266−1,,35.5411969,139.5920768
神奈川県横浜市加賀原1−22−30,,35.5238396,139.5578575
神奈川県横浜市茅ｹ崎中央5−1,,35.5442223,139.5722386
神奈川県横浜市上矢部町619−10,,35.4237469,139.5328512
神奈川県横浜市上飯田町874−1,,35.4143357,139.4845633
神奈川県横浜市獅子ｹ谷3−4−32,,35.5219284,139.6449302
神奈川県横浜市北寺尾5−7−20,,35.5130399,139.6549739
神奈川県横浜市矢向3−11−48,,35.536245,139.6769298
神奈川県横浜市中央2−42−15,,35.4544142,139.6139498
神奈川県横浜市簑沢50−1,,35.4266791,139.6376312
神奈川県横浜市平楽133,,35.4321628,139.6314361
神奈川県横浜市大久保1−20−39,,35.4079413,139.5936179
神奈川県横浜市大久保1−9−25,,35.4107122,139.5937619
神奈川県横浜市今井町502−5,,35.4538947,139.5583034
神奈川県横浜市鶴ｹ峰2−5−23,,35.4767403,139.5455021
神奈川県横浜市原町14−2,,35.4151926,139.6302663
神奈川県横浜市日吉本町5−74−1,,35.5504469,139.6267809
神奈川県横浜市新横浜3−24−14,,35.5140419,139.6203613
神奈川県横浜市新横浜1−19−18,,35.5056864,139.612475
神奈川県横浜市新横浜3−24−14,,35.5140419,139.6203613
神奈川県横浜市中山1−22−22,,35.5156008,139.5403411
神奈川県横浜市南山田2−26−8,,35.5573959,139.5881219
神奈川県横浜市高山6−23,,35.5372609,139.5602332
神奈川県横浜市新橋町1175−1,,35.4357786,139.5132115
神奈川県横浜市菊名6−21−17,,35.5155852,139.6310824
神奈川県横浜市神大寺2−1−7,,35.4818954,139.6092451
神奈川県横浜市菅田町488,,35.4973786,139.5744844
神奈川県横浜市松見町1−28−4,,35.4992873,139.6413835
神奈川県横浜市中村町4−270,,35.4328369,139.6249492
神奈川県横浜市永田みなみ台5−1,,35.4322195,139.5893223
神奈川県横浜市井土ｹ谷下町13−17,,35.4300202,139.6066543
神奈川県横浜市岩井町238,,35.4420032,139.6033911
神奈川県横浜市滝頭2−31−32,,35.4195212,139.6232182
神奈川県横浜市並木1−4−4,,35.3739481,139.6384358
神奈川県横浜市仲手原2−20−19,,35.4961823,139.631465
神奈川県横浜市日吉本町4−10−52,,35.5454947,139.6347499
神奈川県横浜市菊名3−10−20,,35.5058126,139.6380011
神奈川県横浜市大倉山4−24−7,,35.5207778,139.6224746
神奈川県横浜市十日市場町1296,,35.5221644,139.5117355
神奈川県横浜市美しが丘2−2−1,,35.5781032,139.5609107
神奈川県横浜市仲町台3−6−6,,35.5350069,139.593941
神奈川県横浜市茅ｹ崎南5−11−3,,35.5404987,139.5702389
神奈川県横浜市川上町4−9,,35.4290832,139.5563648
神奈川県横浜市和泉町5731−6,,35.4280684,139.4947187
神奈川県横浜市瀬谷3−18−2,,35.4702771,139.4923735
神奈川県横浜市中屋敷2−29−2,,35.4851184,139.474585
神奈川県横浜市善部町44−7,,35.4521155,139.5077233
神奈川県横浜市浜松町13−6,,35.4540219,139.6113145
神奈川県横浜市港南台6−3−16,,35.3733532,139.5857789
神奈川県横浜市豊岡町9−38,,35.5082869,139.6736424
神奈川県横浜市元宮2−5−28,,35.5212186,139.6782963
神奈川県横浜市港南台3−12−2,,35.3780105,139.5787723
神奈川県横浜市港南6−2−8,,35.3985124,139.5907306
神奈川県横浜市坂本町167−5,,35.4665334,139.5776975
神奈川県横浜市大豆戸町552−1,,35.5140399,139.6247683
神奈川県横浜市中山1−21−5,,35.516046,139.5398532
神奈川県横浜市牛久保西3−12−22,,35.561573,139.5792699
神奈川県横浜市佐江戸町2089−1,,35.5193967,139.5608417
神奈川県横浜市東山田町322,,35.5530515,139.6045933
神奈川県横浜市亀住町1−3,,35.482622,139.6389121
神奈川県横浜市霞台41−5,,35.4476349,139.5923545
神奈川県横浜市霞台2−3,,35.4468049,139.5945244
神奈川県横浜市生麦4−5−11,,35.4976057,139.670303
神奈川県横浜市鴨居1−16−14,,35.511516,139.5679456
神奈川県横浜市別所2−14−10,,35.4165736,139.5919355
神奈川県横浜市潮田町4−148−1,,35.5038008,139.6917205
神奈川県横浜市上大岡東1−18−18,,35.4073894,139.5993927
神奈川県横浜市野庭町601,,35.3937308,139.5721339
神奈川県横浜市大久保2−28−27,,35.410107,139.5879222
神奈川県横浜市神戸町104−20,,35.4518794,139.5992769
神奈川県横浜市天王町2−42−29,,35.4553364,139.6024687
神奈川県横浜市滝頭3−1−68,,35.4207697,139.6245683
神奈川県横浜市釜利谷東1−1−3,,35.3401926,139.6181451
神奈川県横浜市六浦5−20−1,,35.3255992,139.6113641
神奈川県横浜市すすき野2−8−6,,35.5776205,139.5266958
神奈川県横浜市荏田北2−11−40,,35.5570455,139.5413472
神奈川県横浜市飯島町527,,35.3736889,139.5355624
神奈川県横浜市公田町740,,35.3601005,139.5588519
神奈川県横浜市野七里1−2−32,,35.3490243,139.5767603
神奈川県横浜市二ﾂ橋町527−2,,35.4742731,139.4985066
神奈川県横浜市鶴ｹ峰2−17−26,,35.4763961,139.547074
神奈川県横浜市小山台1−33−10,,35.3791839,139.5548787
神奈川県横浜市鶴ｹ峰2−69−24,,35.4742359,139.5509778
神奈川県横浜市栗田谷42−43,,35.4814664,139.6178304
神奈川県横浜市上谷本町722,,35.5597198,139.5172619
神奈川県横浜市早渕2−3−77,,35.5449458,139.5991026
神奈川県横浜市長坂8−1,,35.538074,139.571674
神奈川県横浜市日野7−34−7,,35.3887693,139.5772985
神奈川県横浜市勝田町299−1,,35.5424409,139.5915511
神奈川県横浜市永田東3−3−10,,35.4377471,139.5996751
神奈川県横浜市二ﾂ谷町6−3,,35.4769517,139.6298885
神奈川県横浜市長坂7−15,,35.5381022,139.5721049
神奈川県横浜市舞岡町647−4,,35.4063309,139.5500182
神奈川県横浜市和泉中央北3−1−5,,35.4157445,139.4941148
神奈川県横浜市花之木町2−26,,35.4329863,139.6101862
神奈川県横浜市山下町18−3,,35.4430721,139.6523233
神奈川県横浜市汲沢1−27−6,,35.39626,139.5218947
神奈川県横浜市綱島西2−9−8,,35.534774,139.6319467
神奈川県横浜市飯島町2158,,35.3705702,139.5356365
神奈川県横浜市和泉中央北2−16−35,,35.4155732,139.4948647
